<!-- This sample uses nota.xml from https://github.com/nota-game/nota -->
<!-- If you need xml namespaces in the xpath querys, you need to define those in the project root-->
<Project xmlns="https://raw.githubusercontent.com/LokiMidgard/PdfGenerator/master/PdfGenerator/XMLImport.xsd"
           xmlns:xsi="http://www.w3.org/2001/XMLSchema-instance"
         xmlns:nota='http://nota.org/schema/nota'
  xmlns:misc='http://nota.org/schema/misc'
  xmlns:lebewesen="http://nota.org/schema/wesen"
  xmlns:kultur="http://nota.org/schema/kultur"
  xmlns:profession="http://nota.org/schema/profession"
  xmlns:talent="http://nota.org/schema/talent"
  xmlns:fertigkeit="http://nota.org/schema/fertigkeit"
  xmlns:besonderheit="http://nota.org/schema/besonderheit"
  xmlns:aktionen="http://nota.org/schema/kampf/aktionen"
  xmlns:ausstattung="http://nota.org/schema/kampf/ausstattung"
  xsi:schemaLocation="https://raw.githubusercontent.com/LokiMidgard/PdfGenerator/master/PdfGenerator/XMLImport.xsd ../../../../../../PDFGenerator/PDFGenerator/XMLImport.xsd" 
  DefaultLanguage="de-DE">
  <Fonts UseSystemFallback="false" DefaultFont="CMU Serif">
    <Font  FamilyName="CMU Serif" >
      <Regular Path="..\..\..\..\static\fonts\CMU Serif\cmunrm.ttf" />
      <BoldItalic Path="..\..\..\..\static\fonts\CMU Serif\cmunbi.ttf"/>
      <Bold Path="..\..\..\..\static\fonts\CMU Serif\cmunbx.ttf"/>
      <Italic Path="..\..\..\..\static\fonts\CMU Serif\cmunti.ttf" />
    </Font>

    <Font FamilyName="Code200365k">
      <Regular Path="..\..\..\..\static\fonts\Code2003\Code200365k.ttf" />
    </Font>
    <Font FamilyName="BabelStone Roman">
      <Regular Path="..\..\..\..\static\fonts\BabelStone\BabelStoneRoman.ttf" />
    </Font>

     <Font FamilyName="Montreal">
      <Regular Path="..\..\..\..\static\fonts\Montreal\Montreal-Regular.ttf" />
      <Bold Path="..\..\..\..\static\fonts\Montreal\Montreal-Bold.ttf" />
    </Font>

    <Font FamilyName="Quivira">
      <Regular Path="..\..\..\..\static\fonts\Quivira\Quivira.otf" />
    </Font> 
  </Fonts>
  <FallbackFonts>
    <Font FamilyName="Code200365k" />
    <Font FamilyName="BabelStone Roman" />
    <Font FamilyName="Quivira" />
  </FallbackFonts>
  <Templates>
    <Template Context="//nota:Daten/aktionen:Aktionen/aktionen:Aktion" Width="64.9 mm" Height="97 mm" Xslt="PreProcess.xslt">
    <!-- Title-->
      <Text left="10 mm" top="78 mm" width="61 mm" height="5 mm" rotation="-90" >
        <Paragraph  Alignment="Far" EmSize="12" FontStyle="Bold" FontName="Montreal">
          <TextRun>
            <TextPath>Original/aktionen:Aktion/@Name</TextPath>
          </TextRun>
        </Paragraph>
      </Text>
  <!-- Background-->
      <Image left="0 mm" top="0 mm" width="64.9 mm" height="97 mm" ImageLocation="Background-Attack.png" IsVisiblePath="Original/aktionen:Aktion/@Typ='Offensiv'" ZPosition="-2" />
      <Image left="0 mm" top="0 mm" width="64.9 mm" height="97 mm" ImageLocation="Background-Defend.png" IsVisiblePath="Original/aktionen:Aktion/@Typ='Defensiv'" ZPosition="-2" />
      <Image left="0 mm" top="0 mm" width="64.9 mm" height="97 mm" ImageLocation="Background-Seccondär.png" IsVisiblePath="Original/aktionen:Aktion/@Typ='Sekundär'" ZPosition="-2" />
      <Image left="0 mm" top="0 mm" width="64.9 mm" height="97 mm" ImageLocation="Background-Unterstützend.png" IsVisiblePath="Original/aktionen:Aktion/@Typ='Unterstützend'" ZPosition="-2" />

  <!-- AKTION -->
      <Image left="0 mm" 
        top="0 mm" 
        width="64.9 mm" 
        height="97 mm"
        ImageLocation="Aktionen-0-0.png"
        IsVisiblePath="Original/aktionen:Aktion/@Aktionen='0'" ZPosition="-1" />
      <Image left="0 mm" 
        top="0 mm" 
        width="64.9 mm" 
        height="97 mm"
        ImageLocation="Aktionen-0-5.png"
        IsVisiblePath="Original/aktionen:Aktion/@Aktionen='0.5'" ZPosition="-1" />
      <Image left="0 mm" 
        top="0 mm" 
        width="64.9 mm" 
        height="97 mm"
        ImageLocation="Aktionen-1-0.png"
        IsVisiblePath="Original/aktionen:Aktion/@Aktionen='1'" ZPosition="-1" />
      <Image left="0 mm" 
        top="0 mm" 
        width="64.9 mm" 
        height="97 mm"
        ImageLocation="Aktionen-1-5.png"
        IsVisiblePath="Original/aktionen:Aktion/@Aktionen='1.5'" ZPosition="-1" />
      <Image left="0 mm" 
        top="0 mm" 
        width="64.9 mm" 
        height="97 mm"
        ImageLocation="Aktionen-2-0.png"
        IsVisiblePath="Original/aktionen:Aktion/@Aktionen='2'" ZPosition="-1" />


  <!-- KOSTEN-->
      <Text left="10.5 mm" top="9.5 mm" width="4.5 mm" height="4.5 mm">
        <Paragraph  Alignment="Center" EmSize="12" FontStyle="Bold" FontName="Montreal">
          <TextRun>
            <TextPath>Original/aktionen:Aktion/@Kosten</TextPath>
          </TextRun>
        </Paragraph>
      </Text>

  <!-- MODIFIKATION -->
      <Text left="17 mm" top="9 mm" width="40 mm" height="8 mm">
        <Paragraph IsVisiblePath="Malus" Alignment="Center" EmSize="12" FontStyle="Bold"   FontName="Montreal">
          <TextRun FontName="Code200365k">
            <Text>&#10836;</Text>
          </TextRun>
          <TextRun>
            <TextPath>Malus</TextPath>
          </TextRun>
        </Paragraph>
      </Text>
      <Text left="17 mm" top="9 mm" width="40 mm" height="8 mm">
        <Paragraph IsVisiblePath="Bonus" Alignment="Center" EmSize="12" FontStyle="Bold" FontName="Montreal" >
         <TextRun  FontName="Code200365k">
            <Text>&#x2a53;</Text>
          </TextRun>
          <TextRun>
            <TextPath>Bonus</TextPath>
          </TextRun>
        </Paragraph>
      </Text>



  <!-- Haupt text -->
      <Text left="18 mm" top="18 mm" width="37mm" height="60mm" >
        <Paragraph FontStyle="Italic" EmSize="5" IsVisiblePath="Original/aktionen:Aktion/aktionen:Beschreibung" FontName="CMU Serif">
          <TextRun>
            <TextPath>Original/aktionen:Aktion/aktionen:Beschreibung</TextPath>
          </TextRun>
        </Paragraph>

        <Paragraph IsVisiblePath="Original/aktionen:Aktion/aktionen:Bedingung" BeforeParagraph="4mm" AfterParagraph="2mm" FontStyle="Bold" EmSize="7" >
          <TextRun  FontName="Montreal">
            <Text>Bedingung</Text>
          </TextRun>
        </Paragraph>
        <Paragraph IsVisiblePath="Original/aktionen:Aktion/aktionen:Bedingung" BeforeParagraph="1mm" AfterParagraph="0mm" EmSize="6" >
          <TextRun>
            <TextPath>Original/aktionen:Aktion/aktionen:Bedingung</TextPath>
          </TextRun>
        </Paragraph>

        <Paragraph IsVisiblePath="Original/aktionen:Aktion/aktionen:InstantEffekt" BeforeParagraph="4mm" AfterParagraph="2mm" FontStyle="Bold" EmSize="7" >
          <TextRun FontName="Montreal">
            <Text>Augenblicklicher Effekt</Text>
          </TextRun>
        </Paragraph>
        <Paragraph IsVisiblePath="Original/aktionen:Aktion/aktionen:InstantEffekt" BeforeParagraph="1mm" AfterParagraph="0mm" EmSize="6" >
          <TextRun>
            <TextPath>Original/aktionen:Aktion/aktionen:InstantEffekt</TextPath>
          </TextRun>
        </Paragraph>

        <Paragraph IsVisiblePath="Original/aktionen:Aktion/aktionen:GarantierterEffekt" BeforeParagraph="4mm" AfterParagraph="2mm" FontStyle="Bold" EmSize="7" >
          <TextRun FontName="Montreal">
            <Text>Garantierter Effekt</Text>
          </TextRun>
        </Paragraph>
        <Paragraph IsVisiblePath="Original/aktionen:Aktion/aktionen:GarantierterEffekt" BeforeParagraph="1mm" AfterParagraph="0mm" EmSize="6" >
          <TextRun>
            <TextPath>Original/aktionen:Aktion/aktionen:GarantierterEffekt</TextPath>
          </TextRun>
        </Paragraph>

        <Paragraph IsVisiblePath="Original/aktionen:Aktion/aktionen:OffensivErfolg" BeforeParagraph="4mm" AfterParagraph="2mm" FontStyle="Bold" EmSize="7" >
          <TextRun FontName="Montreal">
            <Text>Offensiv Erfolg</Text>
          </TextRun>
        </Paragraph>
        <Paragraph IsVisiblePath="Original/aktionen:Aktion/aktionen:OffensivErfolg" BeforeParagraph="1mm" AfterParagraph="0mm" EmSize="6" >
          <TextRun>
            <TextPath>Original/aktionen:Aktion/aktionen:OffensivErfolg</TextPath>
          </TextRun>
        </Paragraph>

        <Paragraph IsVisiblePath="Original/aktionen:Aktion/aktionen:DefensivErfolg" BeforeParagraph="4mm" AfterParagraph="2mm" FontStyle="Bold" EmSize="7" >
          <TextRun FontName="Montreal">
            <Text>Defensiver Erfolg</Text>
          </TextRun>
        </Paragraph>
        <Paragraph IsVisiblePath="Original/aktionen:Aktion/aktionen:DefensivErfolg" BeforeParagraph="1mm" AfterParagraph="0mm" EmSize="6" >
          <TextRun>
            <TextPath>Original/aktionen:Aktion/aktionen:DefensivErfolg</TextPath>
          </TextRun>
        </Paragraph>

        <Paragraph IsVisiblePath="Original/aktionen:Aktion/aktionen:SekundärErfolg" BeforeParagraph="4mm" AfterParagraph="2mm" FontStyle="Bold" EmSize="7" >
          <TextRun FontName="Montreal">
            <Text>Sekundeärer Erfolg</Text>
          </TextRun>
        </Paragraph>
        <Paragraph IsVisiblePath="Original/aktionen:Aktion/aktionen:SekundärErfolg" BeforeParagraph="1mm" AfterParagraph="0mm" EmSize="6" >
          <TextRun>
            <TextPath>Original/aktionen:Aktion/aktionen:SekundärErfolg</TextPath>
          </TextRun>
        </Paragraph>

        <Paragraph IsVisiblePath="Original/aktionen:Aktion/aktionen:OffensivMiserfolg" BeforeParagraph="4mm" AfterParagraph="2mm" FontStyle="Bold" EmSize="7" >
          <TextRun FontName="Montreal">
            <Text>Offensiver Misserfolg</Text>
          </TextRun>
        </Paragraph>
        <Paragraph IsVisiblePath="Original/aktionen:Aktion/aktionen:OffensivMiserfolg" BeforeParagraph="1mm" AfterParagraph="0mm" EmSize="6" >
          <TextRun>
            <TextPath>Original/aktionen:Aktion/aktionen:OffensivMiserfolg</TextPath>
          </TextRun>
        </Paragraph>